[
  {
    "cause": "ai",
    "stage": "growth",
    "impact": [
      "trust"
    ],
    "severity": {
      "level": "high",
      "score": 6,
      "financial": "N/A"
    },
    "tags": [
      "prompt-injection",
      "adversarial",
      "no-guardrails",
      "brand-damage",
      "twitter"
    ],
    "sources": [
      {
        "title": "Source",
        "url": "https://www.bbc.com/news/technology-35902104",
        "kind": "primary"
      },
      {
        "title": "Source",
        "url": "https://www.cbsnews.com/news/microsoft-shuts-down-ai-chatbot-after-it-turned-into-racist-nazi/",
        "kind": "primary"
      },
      {
        "title": "Source",
        "url": "https://ethicsunwrapped.utexas.edu/case-study/a-i-trust-tays-trespasses",
        "kind": "primary"
      }
    ],
    "year": 2016,
    "title": "Microsoft Tay \u2014 Prompt Injection & Adversarial Manipulation",
    "summary": "Microsoft launched an AI chatbot designed to learn from Twitter users. Within 24 hours, adversarial users manipulated it into generating racist, antisemitic, and inflammatory content.",
    "root_cause": "No adversarial input filtering, no content safeguards, \"learn from everyone\" approach without robustness, trusted users would train it well.",
    "lessons": [
      "Never expose learning systems to unmoderated public input without safeguards",
      "Assume adversarial actors will test every boundary",
      "Trust \"users will teach it good things\" is not a valid architectural assumption",
      "Need content filtering and human-in-loop for anything user-facing"
    ],
    "patterns": [
      "Misconfigured Trust Boundaries"
    ],
    "category": "ai-slop",
    "evidence_type": "direct_incident",
    "id": "microsoft-tay-prompt-injection-adversarial-manipulation-2016"
  },
  {
    "cause": "automation",
    "stage": "scale",
    "impact": [
      "data-loss"
    ],
    "severity": {
      "level": "high",
      "score": 8,
      "financial": "N/A"
    },
    "tags": [
      "no-guardrails",
      "blind-trust",
      "agent-failure",
      "write-access",
      "autonomous-systems"
    ],
    "sources": [
      {
        "title": "Source",
        "url": "https://www.enterpriseai.news/2023/11/when-ai-agents-go-wrong-the-growing-pain-of-autonomous-systems/",
        "kind": "primary"
      },
      {
        "title": "Source",
        "url": "https://news.ycombinator.com/item?id=37810234",
        "kind": "primary"
      },
      {
        "title": "Source",
        "url": "https://www.langchain.com/blog/agent-safety-guardrails",
        "kind": "primary"
      }
    ],
    "year": 2023,
    "title": "AI Agent Deletes Production Data",
    "summary": "An LLM-powered agent with write access executed destructive commands during an ambiguous task, resulting in partial production data loss.",
    "root_cause": "Blind trust in agent autonomy; no guardrails on destructive operations; write access granted without reversible action requirements; insufficient task ambiguity handling.",
    "lessons": [
      "AI agents are junior interns with superpowers \u2014 they need oversight",
      "Never grant write access without reversible actions and kill switches",
      "All destructive operations require explicit human approval",
      "Test agent behavior in sandboxed environments before production"
    ],
    "patterns": [
      "Automation Without Reversal",
      "Blind Trust in AI Output"
    ],
    "category": "ai-slop",
    "evidence_type": "repeated_pattern",
    "id": "ai-agent-deletes-production-data-2023"
  },
  {
    "cause": "automation",
    "stage": "growth",
    "impact": [
      "money"
    ],
    "severity": {
      "level": "high",
      "score": 7,
      "financial": "$7k+"
    },
    "tags": [
      "runaway-costs",
      "token-explosion",
      "agent-loops",
      "no-limits"
    ],
    "sources": [
      {
        "title": "Source",
        "url": "https://news.ycombinator.com/item?id=37291821",
        "kind": "primary"
      },
      {
        "title": "Source",
        "url": "https://github.com/langchain-ai/langchain/issues/10453",
        "kind": "primary"
      },
      {
        "title": "Source",
        "url": "https://community.openai.com/t/gpt-agent-burned-7000-overnight/4821",
        "kind": "primary"
      }
    ],
    "year": 2023,
    "title": "Runaway AI Agents Causing Massive Costs",
    "summary": "Autonomous LLM agents entered infinite loops or continuously called expensive APIs, generating thousands of dollars in token costs within hours.",
    "root_cause": "No token or cost limits on agent actions; recursive self-improvement loops; lack of execution budgets; no circuit breakers on API calls.",
    "lessons": [
      "Always implement cost limits on autonomous agents",
      "Set execution budgets before letting agents run unattended",
      "Monitor token usage in real-time with hard limits",
      "Agent runs should require explicit approval for expensive operations"
    ],
    "patterns": [
      "Automation Without Reversal",
      "Overconfidence From Past Success"
    ],
    "category": "ai-slop",
    "evidence_type": "direct_incident",
    "id": "runaway-ai-agents-causing-massive-costs-2023"
  },
  {
    "cause": "ai",
    "stage": "growth",
    "impact": [
      "users"
    ],
    "tags": [
      "ai-generated-code",
      "no-review",
      "production-bug",
      "copilot"
    ],
    "sources": [
      {
        "title": "Source",
        "url": "https://stackoverflow.blog/2023/11/16/the-risks-of-ai-code-generators/",
        "kind": "primary"
      },
      {
        "title": "Source",
        "url": "https://news.ycombinator.com/item?id=38420156",
        "kind": "primary"
      },
      {
        "title": "Source",
        "url": "https://www.getrevue.co/profileengineering/p/why-we-stopped-merging-ai-code-blindly",
        "kind": "primary"
      }
    ],
    "year": 2026,
    "title": "(2023-2024) AI-Generated Code Shipped Without Review",
    "summary": "Engineering teams merged AI-generated code without adequate review, leading to production bugs, security vulnerabilities, and maintainability issues.",
    "root_cause": "Time pressure to deliver; overconfidence in AI code quality; belief that \"AI knows more than me\"; skipping review for \"obvious\" code.",
    "lessons": [
      "AI-generated code requires at least as much review as human code",
      "Never ship AI code that you don't understand",
      "AI is a generator, not a validator \u2014 outputs need human validation",
      "Establish review checklists specifically for AI-generated code"
    ],
    "patterns": [
      "Blind Trust in AI Output",
      "Overconfidence From Past Success"
    ],
    "category": "ai-slop",
    "evidence_type": "repeated_pattern",
    "severity": {
      "level": "medium"
    },
    "id": "2023-2024-ai-generated-code-shipped-without-review-2026"
  },
  {
    "cause": "ai",
    "stage": "growth",
    "impact": [
      "money"
    ],
    "tags": [
      "seo-collapse",
      "low-quality-content",
      "automation-without-review",
      "content-strategy"
    ],
    "sources": [
      {
        "title": "Source",
        "url": "https://developers.google.com/search/blog/2022/12/helpful-content-update",
        "kind": "primary"
      },
      {
        "title": "Source",
        "url": "https://www.ahrefs.com/blog/ai-content-seo/",
        "kind": "primary"
      },
      {
        "title": "Source",
        "url": "https://www.searchenginejournal.com/ai-content-seo-risks/",
        "kind": "primary"
      }
    ],
    "year": 2023,
    "title": "Low-Quality AI Content Tanking Search Rankings",
    "summary": "Large-scale AI content replaced human-written pages without editorial review, triggering search engine ranking drops across the site.",
    "root_cause": "Low-quality AI output deployed without human review; volume prioritized over quality; search engine algorithm changes exposed poor content; no content quality gates.",
    "lessons": [
      "Search engines reward usefulness, not volume",
      "AI amplifies strategy \u2014 good or bad",
      "Editorial review is mandatory for AI-generated content",
      "Quality gates must exist before deployment"
    ],
    "patterns": [
      "Blind Trust in AI Output",
      "Decision-Making by Proxy"
    ],
    "category": "ai-slop",
    "evidence_type": "direct_incident",
    "severity": {
      "level": "medium"
    },
    "id": "low-quality-ai-content-tanking-search-rankings-2023"
  },
  {
    "cause": "ai",
    "stage": "scale",
    "impact": [
      "data-loss"
    ],
    "tags": [
      "prompt-injection",
      "data-exposure",
      "security",
      "adversarial-input"
    ],
    "sources": [
      {
        "title": "Source",
        "url": "https://owasp.org/www-project-top-10-for-large-language-model-applications/",
        "kind": "primary"
      },
      {
        "title": "Source",
        "url": "https://www.microsoft.com/en-us/security/blog/2023/10/understanding-prompt-injection/",
        "kind": "primary"
      },
      {
        "title": "Source",
        "url": "https://blog.langchain.com/prompt-injection-use-cases/",
        "kind": "primary"
      }
    ],
    "year": 2026,
    "title": "(2023-2024) Adversarial Prompts Exposing Sensitive Data",
    "summary": "Adversarial prompt injection attacks tricked AI systems into revealing sensitive information, bypassing safety measures and outputting private data.",
    "root_cause": "Prompt injection as a novel attack vector; AI systems trusting user input too readily; lack of input sanitization; safety measures bypassed through creative prompting.",
    "lessons": [
      "Prompt injection is the SQL injection of the AI era",
      "Validate and sanitize all inputs, including \"hidden\" prompt fields",
      "Separate untrusted input from system prompts",
      "Build defense-in-depth for AI safety"
    ],
    "patterns": [